[
  {"id":"artifact_void_lens","name":"Void Lens","rarity":"legendary","tags":["artifact","utility"],"lore":"A black crystal that reveals hidden atlas paths.","effects":["Reveal hidden cards that meet non-level gates."],"unique":true},
  {"id":"artifact_bloodquill","name":"Bloodquill Sigil","rarity":"legendary","tags":["artifact","magic"],"lore":"Ink from this quill drinks mana debt and writes in corruption.","effects":["Mana costs can be paid with corruption when mana is insufficient."],"unique":true},
  {"id":"artifact_chronicle_die","name":"Chronicle Die","rarity":"legendary","tags":["artifact","fate"],"lore":"A six-sided relic that remembers one second chance each dawn.","effects":["Gain one risk-check reroll per day."],"unique":true},
  {"id":"artifact_amber_spindle","name":"Amber Spindle","rarity":"legendary","tags":["artifact","time"],"lore":"Threads one extra turn into each expedition.","effects":["Every 5th choice refunds 1 time turn."],"unique":true},
  {"id":"artifact_stone_nightingale","name":"Stone Nightingale","rarity":"legendary","tags":["artifact","social"],"lore":"Sings in faction dialects no human should know.","effects":["+1 reputation on first social choice each day."],"unique":true},
  {"id":"artifact_mirror_ash","name":"Mirror-Ash Mantle","rarity":"legendary","tags":["artifact","defense"],"lore":"Reflects one wound back into smoke.","effects":["First HP loss each day is reduced by 1."],"unique":true},
  {"id":"artifact_tide_compass","name":"Tide Compass","rarity":"legendary","tags":["artifact","navigation"],"lore":"Points to endings, not north.","effects":["Shows one Golden Path hint per arc phase."],"unique":true},
  {"id":"artifact_hollow_crown","name":"Hollow Crown","rarity":"legendary","tags":["artifact","power"],"lore":"A crown that weighs less than guilt.","effects":["+2 might during boss nodes, +2 corruption on success."],"unique":true},
  {"id":"artifact_ink_harbor","name":"Ink Harbor","rarity":"legendary","tags":["artifact","knowledge"],"lore":"Maps itself each time you fail.","effects":["Fail-forward grants +1 knowledge xp bonus."],"unique":true},
  {"id":"artifact_dawn_key","name":"Dawn Key","rarity":"legendary","tags":["artifact","ending"],"lore":"Only turns in doors that should not exist.","effects":["Unlocks pacifist ending predicates in both arcs."],"unique":true},

  {"id":"item_ember_knife","name":"Ember Knife","rarity":"common","tags":["weapon"],"lore":"Keeps a faint red edge even in rain.","effects":["+1 might on combat checks."]},
  {"id":"item_ashbuckler_coat","name":"Ashbuckler Coat","rarity":"common","tags":["armor"],"lore":"Smells permanently of cedar smoke.","effects":["-1 hp loss from hazard checks."]},
  {"id":"item_glass_needle","name":"Glass Needle","rarity":"common","tags":["tool"],"lore":"Used to etch map sigils into crystal.","effects":["+1 craft on puzzle checks."]},
  {"id":"item_briar_tonic","name":"Briar Tonic","rarity":"common","tags":["consumable"],"lore":"Bitter medicine brewed from fungal bark.","effects":["Restore 2 hp when consumed."]},
  {"id":"item_scorch_lantern","name":"Scorch Lantern","rarity":"common","tags":["utility"],"lore":"Burns blue in cursed rooms.","effects":["Reveal danger tag before entering node."]},
  {"id":"item_cracked_ward","name":"Cracked Ward","rarity":"common","tags":["charm"],"lore":"A chipped charm from a ruined chapel.","effects":["+1 resolve on mixed outcomes."]},
  {"id":"item_steel_rosary","name":"Steel Rosary","rarity":"common","tags":["charm"],"lore":"Each bead marks a spared life.","effects":["+1 pilgrims reputation from aid choices."]},
  {"id":"item_vault_spike","name":"Vault Spike","rarity":"common","tags":["tool"],"lore":"Pried from a gate older than cities.","effects":["Open one locked card requirement bypass per run."]},
  {"id":"item_marrow_rope","name":"Marrow Rope","rarity":"common","tags":["utility"],"lore":"Braided from giant reed marrow.","effects":["-1 time cost on one traversal choice/day."]},
  {"id":"item_hex_slate","name":"Hex Slate","rarity":"common","tags":["focus"],"lore":"Records sigils and refuses to forget.","effects":["+1 knowledge when studying archives."]},

  {"id":"item_ember_mail","name":"Ember Mail","rarity":"uncommon","tags":["armor"],"lore":"Warm armor that resists panic.","effects":["+1 resolve in boss nodes."]},
  {"id":"item_dusk_halberd","name":"Dusk Halberd","rarity":"uncommon","tags":["weapon"],"lore":"A polearm tuned to low frequencies.","effects":["+2 might on first combat check each day."]},
  {"id":"item_salt_orb","name":"Salt Orb","rarity":"uncommon","tags":["tool"],"lore":"Pulls moisture out of corrupted air.","effects":["Reduce corruption gain by 1 once per scene."]},
  {"id":"item_char_archive","name":"Char Archive","rarity":"uncommon","tags":["knowledge"],"lore":"A burnt codex with surviving index tabs.","effects":["+1 knowledge and +1 xp from lore scenes."]},
  {"id":"item_hollow_boots","name":"Hollow Boots","rarity":"uncommon","tags":["movement"],"lore":"Footwear that leaves no trail.","effects":["-1 time on first choice in each dungeon."]},
  {"id":"item_shard_buckle","name":"Shard Buckle","rarity":"uncommon","tags":["utility"],"lore":"Flashes when nearby options are gated.","effects":["Show unmet requirement hints in UI."]},
  {"id":"item_forge_idol","name":"Forge Idol","rarity":"uncommon","tags":["craft"],"lore":"A tiny anvil blessed by meteor priests.","effects":["+2 craft on treasure nodes."]},
  {"id":"item_lumen_thread","name":"Lumen Thread","rarity":"uncommon","tags":["magic"],"lore":"Spins mana into stable filaments.","effects":["+1 max mana."]},
  {"id":"item_ink_goggles","name":"Ink Goggles","rarity":"uncommon","tags":["vision"],"lore":"Can read map layers hidden in dark water.","effects":["Reveal one hidden card in current region/day."]},
  {"id":"item_rift_spear","name":"Rift Spear","rarity":"uncommon","tags":["weapon"],"lore":"Makes no sound when thrown.","effects":["+1 might and +1 resolve on success tiers."]},

  {"id":"item_royal_censer","name":"Royal Censer","rarity":"rare","tags":["artifact-lite"],"lore":"Diffuses incense that calms hostile rites.","effects":["Boss node difficulty -1 once per arc."]},
  {"id":"item_storm_folio","name":"Storm Folio","rarity":"rare","tags":["knowledge"],"lore":"Annotated weather from before the Shattering.","effects":["+2 knowledge, +1 corruption on fail-forward." ]},
  {"id":"item_pale_compass","name":"Pale Compass","rarity":"rare","tags":["navigation"],"lore":"Points toward unresolved arc objectives.","effects":["Highlights one arc-critical card." ]},
  {"id":"item_wellglass_shield","name":"Wellglass Shield","rarity":"rare","tags":["defense"],"lore":"Reflects astral debris into harmless sparks.","effects":["Fail-forward hp penalty reduced by 2." ]},
  {"id":"item_archon_fang","name":"Archon Fang","rarity":"rare","tags":["weapon"],"lore":"Trophy carved from a sky-beast mandible.","effects":["+3 might in climaxes." ]},
  {"id":"item_prayer_battery","name":"Prayer Battery","rarity":"rare","tags":["magic"],"lore":"Stores whispers as mana charges.","effects":["Start each day with +1 mana." ]},
  {"id":"item_silver_past","name":"Silver Past","rarity":"rare","tags":["time"],"lore":"A mirror shard that recalls one prior branch.","effects":["Undo one non-ending choice per run." ]},
  {"id":"item_bastion_seal","name":"Bastion Seal","rarity":"rare","tags":["faction"],"lore":"A military seal recognized in emberside keeps.","effects":["+2 concord reputation on oath scenes." ]},
  {"id":"item_orrery_key","name":"Orrery Key","rarity":"rare","tags":["puzzle"],"lore":"Unlocks celestial mechanisms by hum frequency.","effects":["Puzzle checks gain +12 target bonus." ]},
  {"id":"item_quietum_vial","name":"Quietum Vial","rarity":"rare","tags":["consumable"],"lore":"Silences arcane recoil in your veins.","effects":["Set corruption gain to 0 for one scene." ]},

  {"id":"item_lion_of_glass","name":"Lion of Glass","rarity":"legendary","tags":["relic"],"lore":"A statue that prowls in reflections.","effects":["+2 resolve and reveal hidden branch exits." ]},
  {"id":"item_sable_contract","name":"Sable Contract","rarity":"legendary","tags":["faction"],"lore":"Signed by a court that no longer exists.","effects":["Set undercourt reputation floor to 1." ]},
  {"id":"item_ember_orbit","name":"Ember Orbit","rarity":"legendary","tags":["magic"],"lore":"Seven embers circle your wrist when danger rises.","effects":["Combat checks consume 0 mana every other turn." ]},
  {"id":"item_dawnledger","name":"Dawnledger","rarity":"legendary","tags":["ending"],"lore":"Records every ending you deny.","effects":["Unlocks NG+ modifier picker." ]},
  {"id":"item_hush_chalice","name":"Hush Chalice","rarity":"legendary","tags":["ritual"],"lore":"Drinks thunder and leaves calm.","effects":["Daily upkeep world pressure -1 region corruption once/day." ]},
  {"id":"item_penumbral_pin","name":"Penumbral Pin","rarity":"legendary","tags":["stealth"],"lore":"A brooch that edits your silhouette.","effects":["Hazard checks treat mixed as success once per day." ]},
  {"id":"item_starline_reel","name":"Starline Reel","rarity":"legendary","tags":["utility"],"lore":"Spools thread between constellations.","effects":["Travel choices may skip one intermediate dungeon node." ]},
  {"id":"item_choir_helm","name":"Choir Helm","rarity":"legendary","tags":["mind"],"lore":"Hears all outcomes before one is chosen.","effects":["Preview risk tier probabilities." ]},
  {"id":"item_briar_throne","name":"Briar Throne Shard","rarity":"legendary","tags":["power"],"lore":"A splinter from a kingless throne.","effects":["+2 might, +2 corruption on every success." ]},
  {"id":"item_last_lighthouse","name":"Last Lighthouse Lens","rarity":"legendary","tags":["vision"],"lore":"Its beam maps endings across fog.","effects":["Unlock one hidden ending predicate when equipped." ]},